<?xml version="1.0" encoding="UTF-8"?>

<!ELEMENT servlets (servlet*, servlet-mapping*)>
<!ELEMENT servlet (servlet-name, servlet-class)>
<!ELEMENT servlet-name (#PCDATA)>
<!ELEMENT servlet-class (#PCDATA)>
<!ELEMENT servlet-mapping (servlet-name, url-pattern)>
<!ELEMENT url-pattern (#PCDATA)>
